{
  "contractVersion": 2,
  "days": 7,
  "elapsedMs": 23,
  "files": {
    "items": [
      {
        "modified": "2026-10-07T21:15:00+02:00",
        "path": "~/.config/alacritty/alacritty.toml"
      },
      {
        "modified": "2026-10-06T09:30:00+02:00",
        "path": "~/.config/hypr/bindings.conf"
      },
      {
        "modified": "2026-10-03T18:02:11+02:00",
        "path": "~/.config/git/config"
      },
      {
        "modified": "2026-10-01T12:00:00+02:00",
        "path": "~/.config/starship.toml"
      }
    ],
    "ok": true,
    "partial": false,
    "root": "~/.config"
  },
  "generatedAt": "2026-10-08T12:00:00+02:00",
  "pacman": {
    "ok": true,
    "partial": false,
    "transactions": [
      {
        "at": "2026-10-07T16:02:55+02:00",
        "command": "pacman -U /var/cache/pacman/pkg/mesa-1:25.2.4-1-x86_64.pkg.tar.zst",
        "count": 1,
        "kinds": [
          "downgrade"
        ],
        "packages": [
          {
            "from": "1.0-2",
            "kind": "downgrade",
            "name": "mesa",
            "to": "1:25.2.4-1"
          }
        ]
      },
      {
        "at": "2026-10-06T09:41:30+02:00",
        "command": "pacman -S --noconfirm obs-studio",
        "count": 2,
        "kinds": [
          "install"
        ],
        "packages": [
          {
            "kind": "install",
            "name": "qt6-websockets",
            "version": "6.9.3-1"
          },
          {
            "kind": "install",
            "name": "obs-studio",
            "version": "32.0.1-1"
          }
        ],
        "status": "failed"
      },
      {
        "at": "2026-10-05T21:14:06+02:00",
        "command": "pacman -Syu --noconfirm",
        "count": 14,
        "kinds": [
          "upgrade"
        ],
        "packages": [
          {
            "from": "1.0-1",
            "kind": "upgrade",
            "name": "linux",
            "to": "1.0-2"
          },
          {
            "from": "1.0-1",
            "kind": "upgrade",
            "name": "linux-headers",
            "to": "1.0-2"
          },
          {
            "from": "1.0-1",
            "kind": "upgrade",
            "name": "mesa",
            "to": "1.0-2"
          },
          {
            "from": "1.0-1",
            "kind": "upgrade",
            "name": "vulkan-radeon",
            "to": "1.0-2"
          },
          {
            "from": "1.0-1",
            "kind": "upgrade",
            "name": "lib32-mesa",
            "to": "1.0-2"
          },
          {
            "from": "1.0-1",
            "kind": "upgrade",
            "name": "hyprland",
            "to": "1.0-2"
          },
          {
            "from": "1.0-1",
            "kind": "upgrade",
            "name": "hyprlock",
            "to": "1.0-2"
          },
          {
            "from": "1.0-1",
            "kind": "upgrade",
            "name": "waybar",
            "to": "1.0-2"
          },
          {
            "from": "1.0-1",
            "kind": "upgrade",
            "name": "systemd",
            "to": "1.0-2"
          },
          {
            "from": "1.0-1",
            "kind": "upgrade",
            "name": "systemd-libs",
            "to": "1.0-2"
          }
        ]
      },
      {
        "at": "2026-10-04T08:05:10+02:00",
        "command": "pacman -Rns --noconfirm nano",
        "count": 1,
        "kinds": [
          "remove"
        ],
        "packages": [
          {
            "kind": "remove",
            "name": "nano",
            "version": "8.6-1"
          }
        ]
      },
      {
        "at": "2026-10-03T19:22:41+02:00",
        "command": "pacman -S --noconfirm btop",
        "count": 1,
        "kinds": [
          "install"
        ],
        "packages": [
          {
            "kind": "install",
            "name": "btop",
            "version": "1.4.5-1"
          }
        ]
      },
      {
        "at": "2026-10-01T12:00:01+02:00",
        "command": "pacman -Syu",
        "count": 1,
        "kinds": [
          "upgrade"
        ],
        "packages": [
          {
            "from": "2.51.0-1",
            "kind": "upgrade",
            "name": "git",
            "to": "2.51.1-1"
          }
        ]
      }
    ]
  },
  "since": "2026-10-01T12:00:00+02:00",
  "truncated": true
}
